"[SubRipTime(0, 0, 0, 0), SubRipTime(0, 0, 2, 0)]",-0.49223333333333336,This gon na make lot people sad
"[SubRipTime(0, 1, 22, 720), SubRipTime(0, 1, 25, 49)]",0.4331333333333333,Quit wanting cool kids accept
"[SubRipTime(0, 2, 0, 960), SubRipTime(0, 2, 8, 809)]",-0.28952222222222224,"Perfection I quit fear failure fear success I quit hesitation desperation expectations devastations , I quit"
"[SubRipTime(0, 2, 31, 830), SubRipTime(0, 2, 34, 699)]",0.44075454545454545,And I amazing new life
"[SubRipTime(0, 2, 43, 230), SubRipTime(0, 2, 46, 880)]",0.26647575757575753,Hey guys know I 've quit live happier life
"[SubRipTime(0, 2, 53, 599), SubRipTime(0, 2, 59, 509)]",0.5034269841269842,I want hear story way quit . We 've got great goodies prizes available limited time
